lightllm/common/triton_utils/autotune_kernel_configs/triton_3.5.1/NVIDIA_GeForce_RTX_4090_D/scaled_mm_act_per_group_w_perchannel:v1/{K=5120,N=2048,act_quant_group_size=128}_NVIDIA_GeForce_RTX_4090_D.json
{
  "1": {
    "BLOCK_K": 128,
    "BLOCK_M": 8,
    "BLOCK_N": 64,
    "GROUP_M": 8,
    "num_stages": 4,
    "num_warps": 4
  },
  "100": {
    "BLOCK_K": 128,
    "BLOCK_M": 16,
    "BLOCK_N": 128,
    "GROUP_M": 8,
    "num_stages": 3,
    "num_warps": 8
  },
  "1024": {
    "BLOCK_K": 128,
    "BLOCK_M": 64,
    "BLOCK_N": 64,
    "GROUP_M": 8,
    "num_stages": 3,
    "num_warps": 4
  },
  "128": {
    "BLOCK_K": 128,
    "BLOCK_M": 64,
    "BLOCK_N": 64,
    "GROUP_M": 8,
    "num_stages": 5,
    "num_warps": 4
  },
  "16": {
    "BLOCK_K": 128,
    "BLOCK_M": 8,
    "BLOCK_N": 64,
    "GROUP_M": 8,
    "num_stages": 4,
    "num_warps": 4
  },
  "256": {
    "BLOCK_K": 128,
    "BLOCK_M": 32,
    "BLOCK_N": 64,
    "GROUP_M": 8,
    "num_stages": 3,
    "num_warps": 4
  },
  "32": {
    "BLOCK_K": 128,
    "BLOCK_M": 16,
    "BLOCK_N": 64,
    "GROUP_M": 8,
    "num_stages": 3,
    "num_warps": 4
  },
  "64": {
    "BLOCK_K": 128,
    "BLOCK_M": 32,
    "BLOCK_N": 64,
    "GROUP_M": 8,
    "num_stages": 4,
    "num_warps": 8
  },
  "8": {
    "BLOCK_K": 128,
    "BLOCK_M": 8,
    "BLOCK_N": 64,
    "GROUP_M": 8,
    "num_stages": 5,
    "num_warps": 4
  }
}