lightllm/common/triton_utils/autotune_kernel_configs/triton_3.5.1/NVIDIA_H200/grouped_matmul:v1/{K=192,N=2048,expert_num=128,mul_routed_weight=true,out_dtype=torch.bfloat16,topk_num=1,use_fp8_w8a8=false}_NVIDIA_H200.json
{
  "1024": {
    "BLOCK_SIZE_K": 64,
    "BLOCK_SIZE_M": 16,
    "BLOCK_SIZE_N": 128,
    "GROUP_SIZE_M": 64,
    "NEED_TRANS": false,
    "num_stages": 2,
    "num_warps": 4
  },
  "128": {
    "BLOCK_SIZE_K": 64,
    "BLOCK_SIZE_M": 16,
    "BLOCK_SIZE_N": 128,
    "GROUP_SIZE_M": 16,
    "NEED_TRANS": false,
    "num_stages": 3,
    "num_warps": 4
  },
  "192": {
    "BLOCK_SIZE_K": 64,
    "BLOCK_SIZE_M": 16,
    "BLOCK_SIZE_N": 128,
    "GROUP_SIZE_M": 64,
    "NEED_TRANS": false,
    "num_stages": 2,
    "num_warps": 4
  },
  "2048": {
    "BLOCK_SIZE_K": 32,
    "BLOCK_SIZE_M": 32,
    "BLOCK_SIZE_N": 128,
    "GROUP_SIZE_M": 16,
    "NEED_TRANS": false,
    "num_stages": 3,
    "num_warps": 4
  },
  "256": {
    "BLOCK_SIZE_K": 64,
    "BLOCK_SIZE_M": 16,
    "BLOCK_SIZE_N": 128,
    "GROUP_SIZE_M": 1,
    "NEED_TRANS": false,
    "num_stages": 2,
    "num_warps": 4
  },
  "384": {
    "BLOCK_SIZE_K": 64,
    "BLOCK_SIZE_M": 16,
    "BLOCK_SIZE_N": 128,
    "GROUP_SIZE_M": 16,
    "NEED_TRANS": false,
    "num_stages": 2,
    "num_warps": 4
  },
  "512": {
    "BLOCK_SIZE_K": 64,
    "BLOCK_SIZE_M": 16,
    "BLOCK_SIZE_N": 128,
    "GROUP_SIZE_M": 1,
    "NEED_TRANS": false,
    "num_stages": 4,
    "num_warps": 4
  },
  "64": {
    "BLOCK_SIZE_K": 64,
    "BLOCK_SIZE_M": 16,
    "BLOCK_SIZE_N": 128,
    "GROUP_SIZE_M": 1,
    "NEED_TRANS": false,
    "num_stages": 2,
    "num_warps": 4
  },
  "640": {
    "BLOCK_SIZE_K": 64,
    "BLOCK_SIZE_M": 16,
    "BLOCK_SIZE_N": 128,
    "GROUP_SIZE_M": 1,
    "NEED_TRANS": false,
    "num_stages": 2,
    "num_warps": 4
  },
  "768": {
    "BLOCK_SIZE_K": 64,
    "BLOCK_SIZE_M": 16,
    "BLOCK_SIZE_N": 128,
    "GROUP_SIZE_M": 64,
    "NEED_TRANS": false,
    "num_stages": 2,
    "num_warps": 4
  },
  "8": {
    "BLOCK_SIZE_K": 32,
    "BLOCK_SIZE_M": 16,
    "BLOCK_SIZE_N": 64,
    "GROUP_SIZE_M": 1,
    "NEED_TRANS": false,
    "num_stages": 2,
    "num_warps": 4
  },
  "800": {
    "BLOCK_SIZE_K": 64,
    "BLOCK_SIZE_M": 16,
    "BLOCK_SIZE_N": 128,
    "GROUP_SIZE_M": 32,
    "NEED_TRANS": false,
    "num_stages": 2,
    "num_warps": 4
  },
  "8192": {
    "BLOCK_SIZE_K": 64,
    "BLOCK_SIZE_M": 64,
    "BLOCK_SIZE_N": 128,
    "GROUP_SIZE_M": 32,
    "NEED_TRANS": false,
    "num_stages": 2,
    "num_warps": 4
  },
  "896": {
    "BLOCK_SIZE_K": 32,
    "BLOCK_SIZE_M": 16,
    "BLOCK_SIZE_N": 128,
    "GROUP_SIZE_M": 64,
    "NEED_TRANS": false,
    "num_stages": 3,
    "num_warps": 4
  },
  "96": {
    "BLOCK_SIZE_K": 64,
    "BLOCK_SIZE_M": 16,
    "BLOCK_SIZE_N": 64,
    "GROUP_SIZE_M": 32,
    "NEED_TRANS": false,
    "num_stages": 4,
    "num_warps": 4
  }
}