lightllm/common/triton_utils/autotune_kernel_configs/triton_3.5.1/NVIDIA_H200/_fwd_kernel_flash_decode_normal_stage1:v3/{block_seq=256,gqa_group_size=4,kv_quant_group_size=8,out_dtype=torch.bfloat16,q_head_dim=128}_NVIDIA_H200.json
{
  "1000001024": {
    "BLOCK_N": 128,
    "num_stages": 4,
    "num_warps": 4
  },
  "1000002048": {
    "BLOCK_N": 128,
    "num_stages": 4,
    "num_warps": 4
  },
  "1000008192": {
    "BLOCK_N": 128,
    "num_stages": 2,
    "num_warps": 16
  },
  "1000016384": {
    "BLOCK_N": 128,
    "num_stages": 4,
    "num_warps": 8
  },
  "128000001024": {
    "BLOCK_N": 32,
    "num_stages": 6,
    "num_warps": 4
  },
  "128000002048": {
    "BLOCK_N": 16,
    "num_stages": 4,
    "num_warps": 2
  },
  "128000008192": {
    "BLOCK_N": 16,
    "num_stages": 4,
    "num_warps": 2
  },
  "128000016384": {
    "BLOCK_N": 16,
    "num_stages": 4,
    "num_warps": 2
  },
  "16000001024": {
    "BLOCK_N": 128,
    "num_stages": 2,
    "num_warps": 16
  },
  "16000002048": {
    "BLOCK_N": 128,
    "num_stages": 2,
    "num_warps": 16
  },
  "16000008192": {
    "BLOCK_N": 64,
    "num_stages": 2,
    "num_warps": 4
  },
  "16000016384": {
    "BLOCK_N": 16,
    "num_stages": 4,
    "num_warps": 2
  },
  "32000001024": {
    "BLOCK_N": 128,
    "num_stages": 2,
    "num_warps": 16
  },
  "32000002048": {
    "BLOCK_N": 128,
    "num_stages": 4,
    "num_warps": 4
  },
  "32000008192": {
    "BLOCK_N": 16,
    "num_stages": 4,
    "num_warps": 2
  },
  "32000016384": {
    "BLOCK_N": 16,
    "num_stages": 4,
    "num_warps": 2
  },
  "64000001024": {
    "BLOCK_N": 128,
    "num_stages": 4,
    "num_warps": 4
  },
  "64000002048": {
    "BLOCK_N": 32,
    "num_stages": 6,
    "num_warps": 4
  },
  "64000008192": {
    "BLOCK_N": 16,
    "num_stages": 4,
    "num_warps": 2
  },
  "64000016384": {
    "BLOCK_N": 16,
    "num_stages": 4,
    "num_warps": 2
  },
  "8000001024": {
    "BLOCK_N": 128,
    "num_stages": 2,
    "num_warps": 16
  },
  "8000002048": {
    "BLOCK_N": 128,
    "num_stages": 2,
    "num_warps": 16
  },
  "8000008192": {
    "BLOCK_N": 128,
    "num_stages": 4,
    "num_warps": 4
  },
  "8000016384": {
    "BLOCK_N": 64,
    "num_stages": 4,
    "num_warps": 2
  }
}